{
  "kind": "cineweave_codex_character_exploration_brief",
  "contractVersion": "2.0.0",
  "worldId": "world.song-poetic-demo",
  "explorationId": "explore.song-woman.face-v1",
  "status": "ready",
  "inputMode": "zero_prompt",
  "creativeBriefRef": {
    "id": "brief.zero-prompt-song-character-01",
    "version": 1,
    "contentHash": "sha256:1111111111111111111111111111111111111111111111111111111111111111"
  },
  "sourcePrompt": "新式宋韵，清冷但温婉，影视真人感，重点看眼神。",
  "purpose": "把用户的感受转成可比较的身份探索方向；本轮只比较面部结构，不用服装、场景或滤镜代替人物身份。",
  "experienceAxes": {
    "visualWorld": "新式宋韵、低饱和诗意历史空间",
    "temperament": [
      {
        "axisId": "restrained",
        "label": "清冷克制",
        "weight": 0.6
      },
      {
        "axisId": "gentle",
        "label": "含蓄温婉",
        "weight": 0.4
      }
    ],
    "representation": "live_action",
    "ornamentDensity": "refined",
    "ageImpression": "young_adult",
    "firstVisualPriority": "gaze",
    "primaryExplorationAxis": "facial_structure"
  },
  "sharedFixture": {
    "framing": "竖幅中近景，正面略偏三分之四，不用夸张透视",
    "camera": "中长焦自然透视，眼平机位，焦点落在双眼之间",
    "lighting": "柔和北向窗光，低对比，保留皮肤纹理与眼周结构",
    "background": "无文字的暖灰室内背景，低细节并与人物保持分离",
    "grooming": "低饱和自然妆面，简洁低髻，不以夸张头饰制造辨识度",
    "wardrobe": "月白与浅青的克制宋韵内层服装，领口轮廓固定",
    "expression": "平静直视镜头，嘴角自然，避免戏剧化表情",
    "preserve": [
      "成年年轻女性年龄感",
      "真人皮肤微纹理与轻微不对称",
      "相同妆发、服装、机位、光线和背景",
      "不以网红模板脸或滤镜化磨皮替代身份"
    ]
  },
  "locks": {
    "hard": [
      "成年年轻女性年龄感",
      "真人影视表现媒介",
      "本轮只改变面部结构"
    ],
    "soft": [
      "清冷 60% 加温婉 40% 的气质比例",
      "宋韵低饱和服装和妆面"
    ],
    "free": [
      "细微发丝和小型无身份意义配饰",
      "背景材质的低频变化"
    ],
    "undefined": [
      "最终脸型与颧骨张力",
      "稳定识别标记",
      "后续全身比例和动作指纹"
    ]
  },
  "unknowns": {
    "assumptions": [
      "用户希望先通过比较感受收敛，而不是先填写专业五官术语",
      "本轮不建立或推断现实人物肖像身份"
    ],
    "openQuestions": [
      "用户更喜欢柔和轮廓还是略有骨感的轮廓",
      "选中方向是否在中性侧光下仍保持身份清晰"
    ],
    "safeDefaults": [
      "使用中性背景、简单造型和低妆来减少内容泄漏",
      "默认不锁定任何具体脸部锚点"
    ]
  },
  "executionBoundary": {
    "providerNeutral": true,
    "generatesMedia": false,
    "humanApprovalRequired": true,
    "notes": "这是探索简报；媒体生成和身份锁定均需后续的人类批准。"
  },
  "validation": {
    "userControlsPreference": true,
    "noUniversalBeautyScore": true,
    "noBiometricInference": true,
    "styleDoesNotOwnIdentity": true,
    "noGenerationClaim": true
  },
  "skillReceipt": {
    "repository": "https://github.com/Wilder1222/cineweave-studio",
    "ref": "v2.0.0",
    "commit": "0123456789abcdef0123456789abcdef01234567",
    "contentHash": "sha256:aaaaaaaaaaaaaaaaaaaaaaaaaaaaaaaaaaaaaaaaaaaaaaaaaaaaaaaaaaaaaaaa",
    "installedBy": "codex-environment",
    "usedAt": "2026-08-20T18:00:00.000Z"
  }
}
